{
 "schema_version": "profile-v1",
 "name": "Foundation i386 invocation and coding",
 "architecture": "i386",
 "endianness": "little",
 "reference": {
  "path": "${BINRECON_REFERENCE}",
  "expected_size": 1630488,
  "expected_sha256": "1165B9063ADD5672514455CA2C9830625BEA2BCE5E46126FB5E8652114C909D6"
 },
 "analyzers": {
  "ida": {
   "enabled": true,
   "executable": "C:/Program Files/IDA Professional 9.4/idat.exe",
   "timeout_seconds": 5400,
   "version": "9.4"
  },
  "ghidra": {
   "enabled": false
  },
  "angr": {
   "enabled": false
  }
 },
 "comparison": {
  "acceptance": "normalized-functions",
  "ignore_metadata": [],
  "entry_points": []
 },
 "output_dir": "../out/foundation-i386-invocation-coding",
 "analysis_scope": [
  {
   "start": 1112623216,
   "end": 1112623232
  },
  {
   "start": 1112634968,
   "end": 1112635032
  },
  {
   "start": 1112635032,
   "end": 1112635836
  },
  {
   "start": 1112638732,
   "end": 1112638744
  },
  {
   "start": 1112640456,
   "end": 1112640564
  },
  {
   "start": 1112645004,
   "end": 1112645028
  },
  {
   "start": 1112645028,
   "end": 1112645268
  },
  {
   "start": 1112645424,
   "end": 1112645440
  },
  {
   "start": 1112645440,
   "end": 1112645448
  },
  {
   "start": 1112645448,
   "end": 1112645464
  },
  {
   "start": 1112645556,
   "end": 1112645804
  },
  {
   "start": 1112648500,
   "end": 1112648584
  },
  {
   "start": 1112648584,
   "end": 1112648624
  },
  {
   "start": 1112654676,
   "end": 1112654736
  },
  {
   "start": 1112657480,
   "end": 1112657492
  },
  {
   "start": 1112668912,
   "end": 1112669068
  },
  {
   "start": 1112669068,
   "end": 1112669104
  },
  {
   "start": 1112669104,
   "end": 1112669188
  },
  {
   "start": 1112669416,
   "end": 1112669424
  },
  {
   "start": 1112669640,
   "end": 1112669736
  },
  {
   "start": 1112669736,
   "end": 1112669876
  },
  {
   "start": 1112670224,
   "end": 1112671128
  },
  {
   "start": 1112673416,
   "end": 1112674184
  },
  {
   "start": 1112674668,
   "end": 1112674684
  },
  {
   "start": 1112675340,
   "end": 1112675364
  },
  {
   "start": 1112680844,
   "end": 1112681588
  },
  {
   "start": 1112689244,
   "end": 1112689296
  },
  {
   "start": 1112693304,
   "end": 1112693616
  },
  {
   "start": 1112693732,
   "end": 1112693792
  },
  {
   "start": 1112693832,
   "end": 1112693844
  },
  {
   "start": 1112693844,
   "end": 1112693880
  },
  {
   "start": 1112693880,
   "end": 1112693920
  },
  {
   "start": 1112693920,
   "end": 1112694008
  },
  {
   "start": 1112694248,
   "end": 1112694272
  },
  {
   "start": 1112695484,
   "end": 1112695792
  },
  {
   "start": 1112695808,
   "end": 1112697696
  },
  {
   "start": 1112707328,
   "end": 1112707340
  },
  {
   "start": 1112708848,
   "end": 1112708916
  },
  {
   "start": 1112716156,
   "end": 1112717164
  },
  {
   "start": 1112724264,
   "end": 1112725464
  },
  {
   "start": 1112750956,
   "end": 1112750992
  },
  {
   "start": 1112755796,
   "end": 1112755860
  },
  {
   "start": 1112786644,
   "end": 1112786684
  },
  {
   "start": 1112786684,
   "end": 1112786724
  },
  {
   "start": 1112824932,
   "end": 1112824976
  },
  {
   "start": 1112840832,
   "end": 1112841936
  },
  {
   "start": 1112842960,
   "end": 1112843024
  },
  {
   "start": 1112861232,
   "end": 1112861276
  },
  {
   "start": 1112861276,
   "end": 1112861296
  },
  {
   "start": 1112871368,
   "end": 1112871520
  },
  {
   "start": 1112871520,
   "end": 1112871880
  },
  {
   "start": 1112872452,
   "end": 1112872464
  },
  {
   "start": 1112872464,
   "end": 1112872576
  },
  {
   "start": 1112897104,
   "end": 1112897720
  },
  {
   "start": 1112900192,
   "end": 1112900232
  },
  {
   "start": 1112905196,
   "end": 1112905208
  },
  {
   "start": 1112997488,
   "end": 1112997656
  },
  {
   "start": 1113007752,
   "end": 1113007764
  },
  {
   "start": 1113007764,
   "end": 1113007776
  },
  {
   "start": 1113007776,
   "end": 1113007800
  },
  {
   "start": 1113007800,
   "end": 1113007832
  },
  {
   "start": 1113007832,
   "end": 1113007900
  },
  {
   "start": 1113007900,
   "end": 1113007992
  },
  {
   "start": 1113007992,
   "end": 1113008008
  },
  {
   "start": 1113008008,
   "end": 1113008032
  },
  {
   "start": 1113008032,
   "end": 1113008084
  },
  {
   "start": 1113008084,
   "end": 1113008096
  },
  {
   "start": 1113008096,
   "end": 1113008144
  },
  {
   "start": 1113008144,
   "end": 1113008168
  },
  {
   "start": 1113008168,
   "end": 1113008180
  },
  {
   "start": 1113008180,
   "end": 1113008224
  },
  {
   "start": 1113008224,
   "end": 1113008272
  },
  {
   "start": 1113008272,
   "end": 1113008324
  },
  {
   "start": 1113008324,
   "end": 1113008332
  },
  {
   "start": 1113008332,
   "end": 1113008360
  },
  {
   "start": 1113008360,
   "end": 1113008372
  },
  {
   "start": 1113008372,
   "end": 1113008384
  },
  {
   "start": 1113008384,
   "end": 1113008400
  },
  {
   "start": 1113008400,
   "end": 1113008472
  },
  {
   "start": 1113008472,
   "end": 1113008484
  },
  {
   "start": 1113008484,
   "end": 1113008524
  },
  {
   "start": 1113008524,
   "end": 1113008580
  },
  {
   "start": 1113008580,
   "end": 1113008624
  },
  {
   "start": 1113008624,
   "end": 1113008632
  },
  {
   "start": 1113011360,
   "end": 1113011484
  },
  {
   "start": 1113011484,
   "end": 1113011612
  },
  {
   "start": 1113011612,
   "end": 1113011672
  },
  {
   "start": 1113011672,
   "end": 1113011728
  },
  {
   "start": 1113011728,
   "end": 1113011800
  },
  {
   "start": 1113011800,
   "end": 1113011924
  },
  {
   "start": 1113011924,
   "end": 1113011960
  },
  {
   "start": 1113011960,
   "end": 1113012040
  },
  {
   "start": 1113012040,
   "end": 1113012076
  },
  {
   "start": 1113012076,
   "end": 1113012132
  },
  {
   "start": 1113012132,
   "end": 1113012168
  },
  {
   "start": 1113012168,
   "end": 1113012224
  },
  {
   "start": 1113012224,
   "end": 1113012296
  },
  {
   "start": 1113012296,
   "end": 1113012308
  },
  {
   "start": 1113012308,
   "end": 1113012316
  },
  {
   "start": 1113012316,
   "end": 1113012328
  },
  {
   "start": 1113012328,
   "end": 1113012388
  },
  {
   "start": 1113012796,
   "end": 1113012832
  },
  {
   "start": 1113012832,
   "end": 1113012872
  },
  {
   "start": 1113012872,
   "end": 1113012904
  },
  {
   "start": 1113012904,
   "end": 1113012940
  },
  {
   "start": 1113012940,
   "end": 1113013052
  },
  {
   "start": 1113013052,
   "end": 1113013104
  },
  {
   "start": 1113013104,
   "end": 1113013144
  },
  {
   "start": 1113013144,
   "end": 1113013184
  },
  {
   "start": 1113013184,
   "end": 1113013196
  },
  {
   "start": 1113013196,
   "end": 1113013232
  },
  {
   "start": 1113013232,
   "end": 1113013272
  },
  {
   "start": 1113013272,
   "end": 1113013308
  },
  {
   "start": 1113013308,
   "end": 1113013336
  },
  {
   "start": 1113013336,
   "end": 1113013352
  },
  {
   "start": 1113013352,
   "end": 1113013408
  },
  {
   "start": 1113013408,
   "end": 1113013448
  },
  {
   "start": 1113013448,
   "end": 1113013500
  },
  {
   "start": 1113013500,
   "end": 1113013544
  },
  {
   "start": 1113013544,
   "end": 1113013568
  },
  {
   "start": 1113013568,
   "end": 1113013584
  },
  {
   "start": 1113013584,
   "end": 1113013660
  },
  {
   "start": 1113013660,
   "end": 1113013696
  },
  {
   "start": 1113013696,
   "end": 1113013816
  },
  {
   "start": 1113013816,
   "end": 1113013868
  },
  {
   "start": 1113013868,
   "end": 1113014028
  },
  {
   "start": 1113014028,
   "end": 1113014056
  },
  {
   "start": 1113014056,
   "end": 1113014120
  },
  {
   "start": 1113014120,
   "end": 1113015056
  },
  {
   "start": 1113015056,
   "end": 1113015092
  },
  {
   "start": 1113015092,
   "end": 1113015128
  },
  {
   "start": 1113015128,
   "end": 1113015488
  },
  {
   "start": 1113015488,
   "end": 1113015584
  },
  {
   "start": 1113015584,
   "end": 1113015640
  },
  {
   "start": 1113015640,
   "end": 1113015804
  },
  {
   "start": 1113015804,
   "end": 1113015864
  },
  {
   "start": 1113015864,
   "end": 1113015880
  },
  {
   "start": 1113015880,
   "end": 1113016024
  },
  {
   "start": 1113016024,
   "end": 1113016040
  },
  {
   "start": 1113016040,
   "end": 1113016116
  },
  {
   "start": 1113016116,
   "end": 1113016132
  },
  {
   "start": 1113016132,
   "end": 1113016144
  },
  {
   "start": 1113016668,
   "end": 1113016680
  }
 ]
}