{
  "schema_version": "profile-v1",
  "name": "pswrap 117.0.2 reconstruction",
  "architecture": "i386",
  "endianness": "little",
  "reference": {
    "path": "${BINRECON_REFERENCE}",
    "expected_size": 107756,
    "expected_sha256": "8276bac9e9ef09b6841dedbeb9e61af38e9bdf2531348f82fc7720c0c2ca825d"
  },
  "rebuilt": {
    "path": "${BINRECON_REBUILT}"
  },
  "analyzers": {
    "ida": {
      "enabled": true,
      "executable": "C:/Program Files/IDA Professional 9.4/idat.exe",
      "timeout_seconds": 900,
      "version": "9.4"
    },
    "ghidra": {
      "enabled": false,
      "executable": "D:/ghidra/support/analyzeHeadless.bat",
      "timeout_seconds": 900,
      "version": "12.1"
    },
    "angr": {
      "enabled": true,
      "executable": ".venv-binrecon/Scripts/python.exe",
      "timeout_seconds": 900,
      "version": "9.3.0"
    }
  },
  "comparison": {
    "acceptance": "normalized-functions",
    "ignore_metadata": [],
    "entry_points": []
  },
  "output_dir": "../out/pswrap"
}
